{
  "schema": "gooo/contribution-profile/v1",
  "id": "starlark",
  "repository": "google/starlark-go",
  "category": "language_runtime",
  "observed_at": "2026-10-24T23:25:40Z",
  "sources": [
    {
      "id": "starlark-plain",
      "kind": "direct_feedback",
      "url": "https://github.com/google/starlark-go/pull/666#issuecomment-6341574942",
      "observed_at": "2026-10-24T23:25:40Z",
      "published_at": "2026-10-22T13:10:09Z",
      "author": "adonovan",
      "author_association": "COLLABORATOR",
      "identity": {
        "comment_id": 6341574942,
        "commit": null,
        "blob": null
      },
      "content_sha256": "76d9a4bda59e293757476850258ecec122fab0e8221c2e3edd7653c84f9161de",
      "scope": "Plain-language request on a technical external review in PR666."
    },
    {
      "id": "starlark-tldr",
      "kind": "direct_feedback",
      "url": "https://github.com/google/starlark-go/pull/666#issuecomment-6342037389",
      "observed_at": "2026-10-24T23:25:40Z",
      "published_at": "2026-10-22T13:32:32Z",
      "author": "bcsgh",
      "author_association": "NONE",
      "identity": {
        "comment_id": 6342037389,
        "commit": null,
        "blob": null
      },
      "content_sha256": "bd510d026bf4bc9aa0787596bf2377ae9026c8ea75e6b3adde8db9fe1fd08ceb",
      "scope": "A second participant asks for a short summary, not a different semantic result."
    },
    {
      "id": "starlark-editorial",
      "kind": "inference",
      "url": "https://github.com/kimjooyoon/gooo-language-bridge/issues/33",
      "observed_at": "2026-10-24T23:25:40Z",
      "published_at": null,
      "author": "kimjooyoon",
      "author_association": "OWNER",
      "identity": {
        "comment_id": null,
        "commit": null,
        "blob": null
      },
      "content_sha256": null,
      "scope": "Owned planning interpretation and adjustable presentation defaults; not an upstream repository rule."
    }
  ],
  "criteria": [
    {
      "id": "starlark-1",
      "kind": "direct_feedback",
      "source_ids": [
        "starlark-plain",
        "starlark-tldr"
      ],
      "applicable_roles": [
        "reviewer"
      ],
      "applicable_phases": [
        "external_review",
        "follow_up",
        "internal_draft"
      ],
      "rule": "Use a short, outcome-first explanation of the API-design point; detailed execution evidence is supporting material."
    },
    {
      "id": "starlark-presentation",
      "kind": "editorial_default",
      "source_ids": [
        "starlark-editorial"
      ],
      "applicable_roles": [
        "author",
        "reviewer",
        "proposer"
      ],
      "applicable_phases": [
        "external_review",
        "follow_up",
        "internal_draft"
      ],
      "rule": "Lead with the bounded outcome, one minimal example and at most one needed action. Word length is advisory, never a correctness or acceptance score."
    }
  ],
  "public_requirements": [],
  "presentation": {
    "focus": "Literal replacement versus capture expansion as a design question when current docs and tests agree.",
    "avoid": [
      "Calling agreement with current docs an implementation/docs defect.",
      "Treating a posted clarification as recipient acceptance."
    ]
  },
  "limits": [
    "A bounded source snapshot is not a complete policy inventory or current posting authority.",
    "Actor association is recorded verbatim; a collaborator or contributor is not automatically a maintainer.",
    "No personality, acceptance probability or universal AI policy is inferred."
  ]
}
